region,facet,level,variable,cluster_name,value,domain
North America,onet_task,0,onet_task_count,implement or monitor processes to reduce property or financial losses.,19,Financial_Services
North America,onet_task,0,onet_task_count,teach patient education programs that include information required to make informed health care and treatment decisions.,19,Healthcare_Medical
North America,onet_task,0,onet_task_count,coordinate due diligence processes and the negotiation or execution of purchase or sale agreements.,19,Business_Management
North America,onet_task,0,onet_task_count,assess the nature and level of threats so that the scope of the problem can be determined.,19,Administrative_Support
North America,onet_task,0,onet_task_count,explain test procedures and safety precautions to patients and provide them with assistance during test procedures.,19,Customer_Service
North America,onet_task,0,onet_task_count,store food in designated containers and storage areas to prevent spoilage.,19,Creative_Communications
North America,onet_task,0,onet_task_count,evaluate and compare the relative quality of various securities in a given industry.,19,Financial_Services
North America,onet_task,0,onet_task_count,compile and maintain patients' medical records to document condition and treatment and to provide data for research or cost control and care improvement efforts.,19,Healthcare_Medical
North America,onet_task,0,onet_task_count,prepare cost-benefit and return-on-investment analyses to aid in decisions on system implementation.,18,Financial_Services
North America,onet_task,0,onet_task_count,plan and conduct special research projects in area of interest or expertise.,18,Research_Analysis
North America,onet_task,0,onet_task_count,provide information or refer individuals to public or private agencies or community services for assistance.,18,Customer_Service
North America,onet_task,0,onet_task_count,select and obtain materials and supplies such as textbooks.,18,Administrative_Support
North America,onet_task,0,onet_task_count,prepare all materials for transactions or execution of deals.,18,Administrative_Support
North America,onet_task,0,onet_task_count,read corporate reports and calculate ratios to determine best prospects for profit on stock purchases.,18,Financial_Services
North America,onet_task,0,onet_task_count,specify users and user access levels for each segment of database.,17,Administrative_Support
North America,onet_task,0,onet_task_count,monitor markets or positions.,17,Financial_Services
North America,onet_task,0,onet_task_count,contact prospective customers to present information and explain available services.,17,Customer_Service
North America,onet_task,0,onet_task_count,analyze and interpret data to increase the understanding of human social behavior.,17,Research_Analysis
North America,onet_task,0,onet_task_count,confer with clients about their medical histories and problems with stress or pain to determine how massage will be most helpful.,17,Customer_Service
North America,onet_task,0,onet_task_count,provide technical support or instruction to staff or customers regarding electronics equipment standards.,17,Education_Training
North America,onet_task,0,onet_task_count,research new financial products or analytics to determine their usefulness.,17,Research_Analysis
North America,onet_task,0,onet_task_count,develop program plans for individuals or assist in plan development.,17,Customer_Service
North America,onet_task,0,onet_task_count,make diagnoses when different illnesses occur together or in situations where the diagnosis may be obscure.,17,Healthcare_Medical
North America,onet_task,0,onet_task_count,make manuscript acceptance or revision recommendations to the publisher.,17,Administrative_Support
North America,onet_task,0,onet_task_count,study archival collections of primary historical sources to help explain the origins and development of cultural patterns.,17,Research_Analysis
North America,onet_task,0,onet_task_count,prepare reports regarding market conditions and merchandise costs.,17,Financial_Services
North America,onet_task,0,onet_task_count,create and enforce database development standards.,17,Professional_Services
North America,onet_task,0,onet_task_count,pray and promote spirituality.,17,Creative_Communications
North America,onet_task,0,onet_task_count,solicit and compile listings of available rental properties.,17,Administrative_Support
North America,onet_task,0,onet_task_count,develop training programs or routines designed to improve athletic performance.,17,Education_Training
North America,onet_task,0,onet_task_count,demonstrate correct use of exercise equipment or performance of exercise routines.,16,Administrative_Support
North America,onet_task,0,onet_task_count,provide training or technical assistance in web site implementation or use.,16,Customer_Service
North America,onet_task,0,onet_task_count,prepare materials and classrooms for class activities.,16,Education_Training
North America,onet_task,0,onet_task_count,decline excessive risks.,16,Administrative_Support
North America,onet_task,0,onet_task_count,write reports or notes to summarize testing procedures or outcomes for physicians or other medical professionals.,16,Healthcare_Medical
North America,onet_task,0,onet_task_count,answer questions from taxpayers and assist them in completing tax forms.,16,Financial_Services
North America,onet_task,0,onet_task_count,conduct social research.,16,Research_Analysis
North America,onet_task,0,onet_task_count,assess patients for risk of suicide attempts.,16,Healthcare_Medical
North America,onet_task,0,onet_task_count,resolve customer complaints regarding sales and service.,16,Customer_Service
North America,onet_task,0,onet_task_count,provide technical support for radio frequency identification device (rfid) technology.,16,Software_Development
North America,onet_task,0,onet_task_count,investigate available investment opportunities to determine compatibility with client financial plans.,16,Financial_Services
North America,onet_task,0,onet_task_count,develop measurement tools to evaluate the effectiveness of instruction or training interventions.,16,Education_Training
North America,onet_task,0,onet_task_count,identify solutions to on-site technical design problems involving electrical systems equipment.,16,Software_Development
North America,onet_task,0,onet_task_count,conduct testing to determine functionality or optimization or to establish limits of photonics systems or components.,16,Software_Development
North America,onet_task,0,onet_task_count,provide user support by diagnosing network and device problems and implementing technical or procedural solutions.,16,Customer_Service
North America,onet_task,0,onet_task_count,research legal issues and write opinions on the issues.,16,Research_Analysis
North America,onet_task,0,onet_task_count,develop databases that support web applications and web sites.,15,Software_Development
North America,onet_task,0,onet_task_count,interpret imaging data and confer with other medical specialists to formulate diagnoses.,15,Healthcare_Medical
North America,onet_task,0,onet_task_count,place special orders or call other stores to find desired items.,15,Administrative_Support
North America,onet_task,0,onet_task_count,document technical specifications and operating standards for telecommunications equipment.,15,Professional_Services
North America,onet_task,0,onet_task_count,explain and enforce safety rules and regulations.,15,Professional_Services
North America,onet_task,0,onet_task_count,check adhesives to ensure that they will work and will remain durable.,15,Administrative_Support
North America,onet_task,0,onet_task_count,develop system interaction or sequence diagrams.,15,Software_Development
North America,onet_task,0,onet_task_count,advise customers on use and care of merchandise.,15,Customer_Service
North America,onet_task,0,onet_task_count,explain and enforce safety regulations and policies.,15,Professional_Services
North America,onet_task,0,onet_task_count,write engineering specifications to clarify design details or functional criteria of experimental electronics units.,15,Professional_Services
North America,onet_task,0,onet_task_count,arrange merchandise and sales promotion displays or issue sales promotion materials to customers.,15,Creative_Communications
North America,onet_task,0,onet_task_count,edit or assist in editing videos for broadcast.,15,Creative_Communications
North America,onet_task,0,onet_task_count,develop and implement organizational policies and procedures for the facility or medical unit.,15,Healthcare_Medical
North America,onet_task,0,onet_task_count,consult with clients to assess risks and to determine security requirements.,15,Customer_Service
North America,onet_task,0,onet_task_count,estimate cost of completed work or of needed renovations or upgrades.,15,Financial_Services
North America,onet_task,0,onet_task_count,develop and test theories,0,Administrative_Support
North America,onet_task,0,onet_task_count,review papers or serve on editorial boards for scientific journals,0,Research_Analysis
North America,onet_task,0,onet_task_count,optimize digital assets,0,Administrative_Support
North America,onet_task,0,onet_task_count,confer with clients to develop strategies for their careers,0,Customer_Service
North America,onet_task,0,onet_task_count,present subject matter to students under the direction and guidance of teachers,0,Education_Training
North America,onet_task,0,onet_task_count,answer telephones,0,Customer_Service
North America,onet_task,0,onet_task_count,plan and develop programs,0,Software_Development
North America,onet_task,0,onet_task_count,create finished art work as decoration,0,Creative_Communications
North America,onet_task,0,onet_task_count,conduct research,0,Research_Analysis
North America,onet_task,0,onet_task_count,gather data on competitors and analyze their prices,0,Research_Analysis
North America,onet_task,0,onet_task_count,measure velocity,0,Administrative_Support
North America,onet_task,0,onet_task_count,develop curriculum and prepare manuals,0,Education_Training
North America,onet_task,0,onet_task_count,design or develop software systems,0,Creative_Communications
North America,onet_task,0,onet_task_count,monitor database performance and perform any necessary maintenance,0,Administrative_Support
North America,onet_task,0,onet_task_count,prepare course materials such as syllabi,0,Education_Training
North America,onet_task,0,onet_task_count,consult with and advise physicians,0,Administrative_Support
North America,onet_task,0,onet_task_count,interpret and explain human resources policies,0,Administrative_Support
North America,onet_task,0,onet_task_count,read,0,Administrative_Support
North America,onet_task,0,onet_task_count,conduct demonstrations to teach such skills as sports,0,Education_Training
North America,onet_task,0,onet_task_count,review and analyze new,0,Research_Analysis
North America,onet_task,0,onet_task_count,prepare meeting agendas,0,Administrative_Support
North America,onet_task,0,onet_task_count,study the objectives,0,Research_Analysis
North America,onet_task,0,onet_task_count,research the chemical effects of substances,0,Research_Analysis
North America,onet_task,0,onet_task_count,record messages,0,Administrative_Support
North America,onet_task,0,onet_task_count,perform or evaluate research,0,Research_Analysis
North America,onet_task,0,onet_task_count,provide information such as directions,0,Business_Management
North America,onet_task,0,onet_task_count,provide information or counseling regarding issues such as animal health care,0,Healthcare_Medical
North America,onet_task,0,onet_task_count,consult with customers or other departments on project status,0,Customer_Service
North America,onet_task,0,onet_task_count,choose subject matter and suitable form to express personal feelings and experiences or ideas,0,Administrative_Support
North America,onet_task,0,onet_task_count,develop financial plans,0,Financial_Services
North America,onet_task,0,onet_task_count,integrate software or hardware components,0,Administrative_Support
North America,onet_task,0,onet_task_count,recommend financial products,0,Financial_Services
North America,onet_task,0,onet_task_count,enter commands or load control media,0,Creative_Communications
North America,onet_task,0,onet_task_count,respond to customer complaints,0,Customer_Service
North America,onet_task,0,onet_task_count,identify tissue structures or cell components to be used in the diagnosis,0,Healthcare_Medical
North America,onet_task,0,onet_task_count,electronically sort and compile text and numerical data,0,Administrative_Support
North America,onet_task,0,onet_task_count,perform or direct revision,0,Business_Management
North America,onet_task,0,onet_task_count,classify,0,Administrative_Support
North America,onet_task,0,onet_task_count,conduct research or assist in the conduct of research,0,Research_Analysis
North America,onet_task,0,onet_task_count,synthesize analyses of test results,0,Administrative_Support
North America,onet_task,0,onet_task_count,participate in student recruitment,0,Education_Training
North America,onet_task,0,onet_task_count,calibrate,0,Administrative_Support
North America,onet_task,0,onet_task_count,maintain or repair plumbing by replacing defective washers,0,Administrative_Support
North America,onet_task,0,onet_task_count,write advertising copy for use by publication,0,Creative_Communications
North America,onet_task,0,onet_task_count,design and apply bioinformatics algorithms including unsupervised and supervised machine learning,0,Software_Development
North America,onet_task,0,onet_task_count,compose business correspondence for supervisors,0,Administrative_Support
North America,onet_task,0,onet_task_count,recommend,0,Administrative_Support
North America,onet_task,0,onet_task_count,inspect and test electrical systems and equipment to locate and diagnose malfunctions,0,Healthcare_Medical
North America,onet_task,0,onet_task_count,visit establishments,0,Administrative_Support
North America,onet_task,0,onet_task_count,read blueprints or other specifications to determine methods of installation,0,Professional_Services
North America,onet_task,0,onet_task_count,develop new or improved ways of preserving,0,Administrative_Support
North America,onet_task,0,onet_task_count,prepare technical reports,0,Software_Development
North America,onet_task,0,onet_task_count,test,0,Administrative_Support
North America,onet_task,0,onet_task_count,design database applications,0,Creative_Communications
North America,onet_task,0,onet_task_count,examine physiological,0,Research_Analysis
North America,onet_task,0,onet_task_count,reformat documents,0,Administrative_Support
North America,onet_task,0,onet_task_count,maintain knowledge of tax code changes,0,Financial_Services
North America,onet_task,0,onet_task_count,study basic principles of plant and animal life,0,Research_Analysis
North America,onet_task,0,onet_task_count,present and explain proposals,0,Administrative_Support
North America,onet_task,0,onet_task_count,perform system analysis,0,Software_Development
North America,onet_task,0,onet_task_count,use the computer in the analysis and solution of business problems,0,Research_Analysis
North America,onet_task,0,onet_task_count,design electronic components,0,Creative_Communications
North America,onet_task,0,onet_task_count,identify or classify species of insects or allied forms,0,Administrative_Support
North America,onet_task,0,onet_task_count,test programs or databases,0,Software_Development
North America,onet_task,0,onet_task_count,research production topics using the internet,0,Research_Analysis
North America,onet_task,0,onet_task_count,answer inquiries regarding information such as schedules,0,Administrative_Support
North America,onet_task,0,onet_task_count,conduct surveys and collect data,0,Research_Analysis
North America,onet_task,0,onet_task_count,prepare written reports that estimate property values,0,Administrative_Support
North America,onet_task,0,onet_task_count,prepare reports or correspondence concerning project specifications,0,Administrative_Support
North America,onet_task,0,onet_task_count,install updated software,0,Administrative_Support
North America,onet_task,0,onet_task_count,consult with users,0,Administrative_Support
North America,onet_task,0,onet_task_count,advise business or other groups on local,0,Business_Management
North America,onet_task,0,onet_task_count,identify or recommend integrated weed and pest management (ipm) strategies,0,Business_Management
North America,onet_task,0,onet_task_count,recommend strategies for clients to meet their financial goals,0,Financial_Services
North America,onet_task,0,onet_task_count,provide information to customers on the care of trees,0,Customer_Service
North America,onet_task,0,onet_task_count,answer questions regarding examinations,0,Administrative_Support
North America,onet_task,0,onet_task_count,evaluate the potential of new product developments or market opportunities,0,Financial_Services
North America,onet_task,0,onet_task_count,demonstrate database technical functionality,0,Software_Development
North America,onet_task,0,onet_task_count,analyze trends in sales prices,0,Research_Analysis
North America,onet_task,0,onet_task_count,evaluate the organization's technology use and needs and recommend improvements,0,Administrative_Support
North America,onet_task,0,onet_task_count,create marketing or outreach media,0,Creative_Communications
North America,onet_task,0,onet_task_count,collect,0,Administrative_Support
North America,onet_task,0,onet_task_count,conduct on-the-job training classes or training sessions to teach and demonstrate principles,0,Education_Training
North America,onet_task,0,onet_task_count,maintain understanding of current web technologies or programming practices through continuing education,0,Software_Development
North America,onet_task,0,onet_task_count,counsel individuals or groups concerning their spiritual,0,Healthcare_Medical
North America,onet_task,0,onet_task_count,prepare instructional program objectives,0,Education_Training
North America,onet_task,0,onet_task_count,consult with writers,0,Administrative_Support
North America,onet_task,0,onet_task_count,answer questions or provide advice to the public regarding licensing policies,0,Professional_Services
North America,onet_task,0,onet_task_count,analyze the financial details of past,0,Research_Analysis
North America,onet_task,0,onet_task_count,perform initial debugging procedures by reviewing configuration files,0,Software_Development
North America,onet_task,0,onet_task_count,retrieve patient medical records for physicians,0,Healthcare_Medical
North America,onet_task,0,onet_task_count,develop problem intervention procedures,0,Administrative_Support
North America,onet_task,0,onet_task_count,respond to requests for information from the public,0,Administrative_Support
North America,onet_task,0,onet_task_count,write and review grant proposals,0,Administrative_Support
North America,onet_task,0,onet_task_count,prepare project status reports by collecting,0,Administrative_Support
North America,onet_task,0,onet_task_count,analyze competitive market strategies through analysis of related product,0,Research_Analysis
North America,onet_task,0,onet_task_count,analyze,0,Research_Analysis
North America,onet_task,0,onet_task_count,conduct searches to find needed information,0,Administrative_Support
North America,onet_task,0,onet_task_count,analyze organizational,0,Research_Analysis
North America,onet_task,0,onet_task_count,enter text into computer keyboard and select the size and style of type,0,Administrative_Support
North America,onet_task,0,onet_task_count,analyze information to determine,0,Research_Analysis
North America,onet_task,0,onet_task_count,install and configure new equipment,0,Administrative_Support
North America,onet_task,0,onet_task_count,develop web site maps,0,Software_Development
North America,onet_task,0,onet_task_count,assess cost effectiveness of products,0,Financial_Services
North America,onet_task,0,onet_task_count,educate the public about health issues or enforce health legislation to prevent disease,0,Healthcare_Medical
North America,onet_task,0,onet_task_count,provide guests with information about local areas,0,Administrative_Support
North America,onet_task,0,onet_task_count,plan and conduct activities for a balanced program of instruction,0,Education_Training
North America,onet_task,0,onet_task_count,prepare specialty foods such as pizzas,0,Administrative_Support
North America,onet_task,0,onet_task_count,gather,0,Administrative_Support
North America,onet_task,0,onet_task_count,teach students personal development skills such as goal setting,0,Education_Training
North America,onet_task,0,onet_task_count,diagnose health problems by reviewing patients' health and medical histories,0,Healthcare_Medical
North America,onet_task,0,onet_task_count,advise customers concerning equipment operation,0,Customer_Service
North America,onet_task,0,onet_task_count,interpret laws,0,Professional_Services
North America,onet_task,0,onet_task_count,prepare documentation or presentations,0,Administrative_Support
North America,onet_task,0,onet_task_count,gather and compile geographic data from sources including censuses,0,Creative_Communications
North America,onet_task,0,onet_task_count,create and maintain accessible,0,Administrative_Support
North America,onet_task,0,onet_task_count,counsel patients about nutrition,0,Healthcare_Medical
North America,onet_task,0,onet_task_count,prepare and deliver lectures to undergraduate or graduate students on topics such as mechanics,0,Education_Training
North America,onet_task,0,onet_task_count,provide professional consulting services to government,0,Business_Management
North America,onet_task,0,onet_task_count,provide patients with information needed to promote health,0,Healthcare_Medical
North America,onet_task,0,onet_task_count,sample and test air to identify gasses,0,Administrative_Support
North America,onet_task,0,onet_task_count,use computers for various applications,0,Software_Development
North America,onet_task,0,onet_task_count,advise students on issues such as course selection,0,Education_Training
North America,onet_task,0,onet_task_count,assess nutritional needs,0,Healthcare_Medical
North America,onet_task,0,onet_task_count,develop system engineering,0,Software_Development
North America,onet_task,0,onet_task_count,instruct individuals,0,Education_Training
North America,onet_task,0,onet_task_count,instruct individuals or groups in the use of art media,0,Creative_Communications
North America,onet_task,0,onet_task_count,document and communicate database schemas,0,Administrative_Support
North America,onet_task,0,onet_task_count,create debt management plans,0,Business_Management
North America,onet_task,0,onet_task_count,use mediation techniques to facilitate communication between disputants,0,Creative_Communications
North America,onet_task,0,onet_task_count,educate patients about diagnoses,0,Healthcare_Medical
North America,onet_task,0,onet_task_count,research,0,Research_Analysis
North America,onet_task,0,onet_task_count,identify psychological,0,Administrative_Support
North America,onet_task,0,onet_task_count,propose product designs involving microelectromechanical systems (mems) technology,0,Creative_Communications
North America,onet_task,0,onet_task_count,conduct research in a particular field of knowledge and publish findings in books,0,Research_Analysis
North America,onet_task,0,onet_task_count,instruct individuals or groups in sports rules,0,Education_Training
North America,onet_task,0,onet_task_count,study and interpret religious laws,0,Research_Analysis
North America,onet_task,0,onet_task_count,plan and conduct research to develop and test theories about societal issues such as crime,0,Research_Analysis
North America,onet_task,0,onet_task_count,attend sales or trade meetings or read related publications to obtain information about market conditions,0,Financial_Services
North America,onet_task,0,onet_task_count,counsel clients or patients,0,Healthcare_Medical
North America,onet_task,0,onet_task_count,provide information and advice to the public regarding the selection,0,Administrative_Support
North America,onet_task,0,onet_task_count,plan or direct development or communication of programs to maintain favorable public or stockholder perceptions of an organization's accomplishments,0,Creative_Communications
North America,onet_task,0,onet_task_count,develop or manage integrated security controls to ensure confidentiality,0,Business_Management
North America,onet_task,0,onet_task_count,advise management concerning personnel,0,Business_Management
North America,onet_task,0,onet_task_count,provide students with information on such topics as college degree programs and admission requirements,0,Education_Training
North America,onet_task,0,onet_task_count,inform businesses,0,Business_Management
North America,onet_task,0,onet_task_count,examine immigration applications,0,Research_Analysis
North America,onet_task,0,onet_task_count,read food order slips or receive verbal instructions as to food required by patron,0,Education_Training
North America,onet_task,0,onet_task_count,provide public education and consultation to other professionals or groups regarding counseling services,0,Education_Training
North America,onet_task,0,onet_task_count,provide technical assistance in resolving electrical engineering problems encountered before,0,Professional_Services
North America,onet_task,0,onet_task_count,prepare specifications,0,Professional_Services
