region,facet,level,variable,cluster_name,value,domain
APAC,onet_task,0,onet_task_count,not_classified,58915,not_classified
APAC,onet_task,0,onet_task_count,none,9139,none
APAC,onet_task,0,onet_task_count,correct errors by making appropriate changes and rechecking the program to ensure that the desired results are produced.,6296,Software_Development
APAC,onet_task,0,onet_task_count,assist students who need extra help with their coursework outside of class.,3955,Education_Training
APAC,onet_task,0,onet_task_count,develop instructional materials to be used by educators and instructors.,2720,Education_Training
APAC,onet_task,0,onet_task_count,prepare and deliver lectures to undergraduate or graduate students on topics such as how to speak and write a foreign language and the cultural aspects of areas where a particular language is used.,1998,Education_Training
APAC,onet_task,0,onet_task_count,analyze user needs and software requirements to determine feasibility of design within time and cost constraints.,1988,Research_Analysis
APAC,onet_task,0,onet_task_count,develop new software applications or customize existing applications to meet specific scientific project needs.,1745,Software_Development
APAC,onet_task,0,onet_task_count,develop or apply data mining and machine learning algorithms.,1609,Software_Development
APAC,onet_task,0,onet_task_count,confer with clients regarding the nature of the information processing or computation needs a computer program is to address.,1591,Software_Development
APAC,onet_task,0,onet_task_count,write supporting code for web applications or web sites.,1482,Software_Development
APAC,onet_task,0,onet_task_count,modify existing programs to enhance efficiency.,1461,Software_Development
APAC,onet_task,0,onet_task_count,provide feedback and recommendations to developers on software usability and functionality.,772,Software_Development
APAC,onet_task,0,onet_task_count,develop application-specific software.,757,Software_Development
APAC,onet_task,0,onet_task_count,provide technical guidance or support for the development or troubleshooting of systems.,750,Customer_Service
APAC,onet_task,0,onet_task_count,guide clients in the development of skills or strategies for dealing with their problems.,746,Customer_Service
APAC,onet_task,0,onet_task_count,assess the usefulness of pre-developed application packages and adapt them to a user environment.,695,Software_Development
APAC,onet_task,0,onet_task_count,respond to program error messages by finding and correcting problems or terminating the program.,648,Software_Development
APAC,onet_task,0,onet_task_count,help programmers and systems analysts test and debug new programs.,597,Software_Development
APAC,onet_task,0,onet_task_count,consult with multiple stakeholders to define requirements and implement online features.,579,Administrative_Support
APAC,onet_task,0,onet_task_count,modify existing databases and database management systems or direct programmers and analysts to make changes.,532,Software_Development
APAC,onet_task,0,onet_task_count,conduct internet-based and library research.,528,Research_Analysis
APAC,onet_task,0,onet_task_count,provide professional consulting services to government or industry.,524,Business_Management
APAC,onet_task,0,onet_task_count,develop or maintain internal or external company web sites.,372,Software_Development
APAC,onet_task,0,onet_task_count,conduct research to gather information about survey topics.,347,Research_Analysis
APAC,onet_task,0,onet_task_count,provide assistance to students in college writing centers.,334,Education_Training
APAC,onet_task,0,onet_task_count,reinstall software programs or adjust settings on existing software to fix machine malfunctions.,331,Software_Development
APAC,onet_task,0,onet_task_count,configure servers to meet functional specifications.,293,Software_Development
APAC,onet_task,0,onet_task_count,discuss the treatment of problems with clients.,266,Healthcare_Medical
APAC,onet_task,0,onet_task_count,troubleshoot network or connectivity problems for users or user groups.,265,Software_Development
APAC,onet_task,0,onet_task_count,tutor and assist children individually or in small groups to help them master assignments and to reinforce learning concepts presented by teachers.,261,Education_Training
APAC,onet_task,0,onet_task_count,participate in the work of subordinates to facilitate productivity or to overcome difficult aspects of work.,261,Creative_Communications
APAC,onet_task,0,onet_task_count,modify and customize commercial programs for internal needs.,255,Software_Development
APAC,onet_task,0,onet_task_count,write computer programs or scripts to be used in querying databases.,252,Software_Development
APAC,onet_task,0,onet_task_count,develop instructional materials and conduct in-service and community-based educational programs.,244,Education_Training
APAC,onet_task,0,onet_task_count,analyze experimental data and interpret results to write reports and summaries of findings.,226,Research_Analysis
APAC,onet_task,0,onet_task_count,consult with and assist computer operators or system analysts to define and resolve problems in running computer programs.,219,Software_Development
APAC,onet_task,0,onet_task_count,conduct materials test and analysis using tools and equipment and applying engineering knowledge.,205,Professional_Services
APAC,onet_task,0,onet_task_count,develop curricula and plan course content and methods of instruction.,204,Education_Training
APAC,onet_task,0,onet_task_count,design and create special programs for tasks such as statistical analysis and data entry and cleaning.,203,Research_Analysis
APAC,onet_task,0,onet_task_count,prepare appropriate formatting to data sets as requested.,202,Administrative_Support
APAC,onet_task,0,onet_task_count,analyze system performance or operational requirements.,190,Research_Analysis
APAC,onet_task,0,onet_task_count,prepare management reports defining and evaluating problems and recommending solutions.,190,Business_Management
APAC,onet_task,0,onet_task_count,counsel workers about job and career-related issues.,188,Healthcare_Medical
APAC,onet_task,0,onet_task_count,analyze financial information obtained from clients to determine strategies for meeting clients' financial objectives.,181,Financial_Services
APAC,onet_task,0,onet_task_count,evaluate or recommend software for testing or bug tracking.,181,Administrative_Support
APAC,onet_task,0,onet_task_count,observe and evaluate students' work to determine progress and make suggestions for improvement.,174,Education_Training
APAC,onet_task,0,onet_task_count,greet customers and ascertain what each customer wants or needs.,169,Customer_Service
APAC,onet_task,0,onet_task_count,provide individual support or counseling in general wellness or nutrition.,167,Healthcare_Medical
APAC,onet_task,0,onet_task_count,plan parties or other special events and services.,166,Customer_Service
APAC,onet_task,0,onet_task_count,develop methods for integrating different products so they work properly together such as customizing commercial databases to fit specific needs.,160,Administrative_Support
APAC,onet_task,0,onet_task_count,write computer or microprocessor software programs.,155,Software_Development
APAC,onet_task,0,onet_task_count,advise students on academic and vocational curricula and on career issues.,153,Education_Training
APAC,onet_task,0,onet_task_count,evaluate sources of information to determine any limitations in terms of reliability or usability.,146,Administrative_Support
APAC,onet_task,0,onet_task_count,develop concepts or creative ideas for craft objects.,145,Creative_Communications
APAC,onet_task,0,onet_task_count,analyze characteristics of animals to identify and classify them.,140,Research_Analysis
APAC,onet_task,0,onet_task_count,define the goals of the system and devise flow charts and diagrams describing logical operational steps of programs.,139,Business_Management
APAC,onet_task,0,onet_task_count,develop instructional materials and products for technology-based redesign of courses.,137,Education_Training
APAC,onet_task,0,onet_task_count,develop or implement procedures for ongoing web site revision.,136,Software_Development
APAC,onet_task,0,onet_task_count,provide system design and integration recommendations.,133,Software_Development
APAC,onet_task,0,onet_task_count,evaluate or recommend server hardware or software.,132,Software_Development
APAC,onet_task,0,onet_task_count,recommend and provide advice on a wide variety of products and services.,131,Customer_Service
APAC,onet_task,0,onet_task_count,adapt instructional content or delivery methods for different levels or types of learners.,128,Education_Training
APAC,onet_task,0,onet_task_count,explain federal and state tax laws to individuals and companies.,124,Financial_Services
APAC,onet_task,0,onet_task_count,use nondisciplinary tools and equipment such as a computer.,121,Administrative_Support
APAC,onet_task,0,onet_task_count,provide technical support or assistance to chemists or engineers.,120,Software_Development
APAC,onet_task,0,onet_task_count,prepare responses to correspondence containing routine inquiries.,110,Administrative_Support
APAC,onet_task,0,onet_task_count,synthesize current business intelligence or trend data to support recommendations for action.,109,Customer_Service
APAC,onet_task,0,onet_task_count,analyze information obtained from management to conceptualize and define operational problems.,108,Business_Management
APAC,onet_task,0,onet_task_count,prepare technical reports and recommendations based upon research outcomes.,105,Research_Analysis
APAC,onet_task,0,onet_task_count,use computer software to generate new images.,104,Software_Development
APAC,onet_task,0,onet_task_count,use models to simulate the behavior of animated objects in the finished sequence.,104,Administrative_Support
APAC,onet_task,0,onet_task_count,consult with customers about software system design and maintenance.,101,Software_Development
APAC,onet_task,0,onet_task_count,advise clients on financial and legal matters such as investments and taxes.,100,Financial_Services
APAC,onet_task,0,onet_task_count,develop and maintain computer databases.,97,Administrative_Support
APAC,onet_task,0,onet_task_count,analyze target companies or investment opportunities to inform investment decisions.,96,Research_Analysis
APAC,onet_task,0,onet_task_count,write press releases or other media communications to promote clients.,94,Creative_Communications
APAC,onet_task,0,onet_task_count,monitor and analyze sales promotion results to determine cost effectiveness of promotion campaigns.,92,Creative_Communications
APAC,onet_task,0,onet_task_count,teach classes and present self-help or information sessions on subjects related to education and career planning.,90,Education_Training
APAC,onet_task,0,onet_task_count,respond to customer inquiries or complaints.,90,Customer_Service
APAC,onet_task,0,onet_task_count,create custom illustrations or other graphic elements.,89,Creative_Communications
APAC,onet_task,0,onet_task_count,prepare and deliver sermons or other talks.,85,Administrative_Support
APAC,onet_task,0,onet_task_count,direct or provide home health services.,82,Healthcare_Medical
APAC,onet_task,0,onet_task_count,teach political science.,79,Education_Training
APAC,onet_task,0,onet_task_count,advise clients on how they could be helped by counseling.,77,Customer_Service
APAC,onet_task,0,onet_task_count,study documentation or other information for new scientific or technical products.,73,Research_Analysis
APAC,onet_task,0,onet_task_count,study the structure and composition of food or the changes foods undergo in storage and processing.,71,Research_Analysis
APAC,onet_task,0,onet_task_count,develop or analyze information to assess the current or future financial status of firms.,70,Research_Analysis
APAC,onet_task,0,onet_task_count,explain stock market terms or trading practices to clients.,66,Financial_Services
APAC,onet_task,0,onet_task_count,seek and provide information to help companies determine their position in the marketplace.,65,Financial_Services
APAC,onet_task,0,onet_task_count,respond to general inquiries or requests from the public.,65,Administrative_Support
APAC,onet_task,0,onet_task_count,read technical literature and participate in continuing education or professional associations to maintain awareness of current database technology and best practices.,65,Education_Training
APAC,onet_task,0,onet_task_count,prepare or proctor examinations.,64,Administrative_Support
APAC,onet_task,0,onet_task_count,program electronic equipment.,61,Software_Development
APAC,onet_task,0,onet_task_count,write original literary pieces.,60,Administrative_Support
APAC,onet_task,0,onet_task_count,prepare reports and document project activities and data.,57,Administrative_Support
APAC,onet_task,0,onet_task_count,program computerized graphic effects.,55,Creative_Communications
APAC,onet_task,0,onet_task_count,develop or implement marketing strategies.,55,Creative_Communications
APAC,onet_task,0,onet_task_count,interpret diagnostic test results for deviations from normal.,55,Administrative_Support
APAC,onet_task,0,onet_task_count,analyze patrons' requests to determine needed information and assist in furnishing or locating that information.,55,Research_Analysis
APAC,onet_task,0,onet_task_count,review manuscripts for publication in books and professional journals.,54,Administrative_Support
APAC,onet_task,0,onet_task_count,provide technical customer service.,51,Customer_Service
APAC,onet_task,0,onet_task_count,develop or direct software system testing or validation procedures.,49,Software_Development
APAC,onet_task,0,onet_task_count,transcribe recorded proceedings in accordance with established formats.,48,Administrative_Support
APAC,onet_task,0,onet_task_count,design or develop automated testing tools.,48,Creative_Communications
APAC,onet_task,0,onet_task_count,direct software programming and development of documentation.,46,Software_Development
APAC,onet_task,0,onet_task_count,develop and document database architectures.,46,Administrative_Support
APAC,onet_task,0,onet_task_count,offer advice on the purchase or sale of particular securities.,44,Financial_Services
APAC,onet_task,0,onet_task_count,compile bibliographies of specialized materials for outside reading assignments.,44,Administrative_Support
APAC,onet_task,0,onet_task_count,complete form letters in response to requests or problems identified by correspondence.,44,Administrative_Support
APAC,onet_task,0,onet_task_count,provide customer service by greeting and assisting customers and responding to customer inquiries and complaints.,41,Customer_Service
APAC,onet_task,0,onet_task_count,develop standards and guidelines to guide the use and acquisition of software and to protect vulnerable information.,41,Professional_Services
APAC,onet_task,0,onet_task_count,write about and present research findings for a variety of specialized and general audiences.,40,Research_Analysis
APAC,onet_task,0,onet_task_count,measure and analyze system performance and operating parameters to assess operating condition of systems or equipment.,40,Research_Analysis
APAC,onet_task,0,onet_task_count,compile bibliographies and prepare abstracts on subjects of interest to particular organizations or groups.,40,Creative_Communications
APAC,onet_task,0,onet_task_count,interpret government regulations and applicable codes to ensure compliance.,39,Professional_Services
APAC,onet_task,0,onet_task_count,develop mathematical or statistical models of phenomena to be used for analysis or for computational simulation.,39,Research_Analysis
APAC,onet_task,0,onet_task_count,compile and format image data to increase its usefulness.,38,Administrative_Support
APAC,onet_task,0,onet_task_count,write detailed functional specifications that document the hardware development process and support hardware introduction.,38,Customer_Service
APAC,onet_task,0,onet_task_count,write reports on research findings and implications to contribute to general knowledge and to suggest potential changes in organizational functioning.,38,Research_Analysis
APAC,onet_task,0,onet_task_count,advise students on academic and vocational curricula and career issues.,37,Education_Training
APAC,onet_task,0,onet_task_count,greet visitors or callers and handle their inquiries or direct them to the appropriate persons according to their needs.,37,Business_Management
APAC,onet_task,0,onet_task_count,write and code logical and physical database descriptions and specify identifiers of database to management system or direct others in coding descriptions.,37,Business_Management
APAC,onet_task,0,onet_task_count,study and analyze information about alternative courses of action to determine which plan will offer the best outcomes.,37,Research_Analysis
APAC,onet_task,0,onet_task_count,plan and price menu items.,37,Administrative_Support
APAC,onet_task,0,onet_task_count,review procedures in database management system manuals for making changes to database.,34,Software_Development
APAC,onet_task,0,onet_task_count,arrange for advertising or posting of job vacancies and notify eligible workers of position availability.,34,Creative_Communications
APAC,onet_task,0,onet_task_count,record symbols on computer storage media and use computer aided transcription to translate and display them as text.,34,Administrative_Support
APAC,onet_task,0,onet_task_count,develop and document style guidelines for web site content.,33,Software_Development
APAC,onet_task,0,onet_task_count,help children with homework and school work.,33,Customer_Service
APAC,onet_task,0,onet_task_count,research and identify potential customers for products or services.,32,Customer_Service
APAC,onet_task,0,onet_task_count,conduct market research and analyze industry trends.,32,Research_Analysis
APAC,onet_task,0,onet_task_count,provide technical support for robotic systems.,32,Software_Development
APAC,onet_task,0,onet_task_count,perform security analyses of developed or packaged software components.,31,Administrative_Support
APAC,onet_task,0,onet_task_count,produce rough and finished graphics and graphic designs.,29,Creative_Communications
APAC,onet_task,0,onet_task_count,develop software applications or programming to use for statistical modeling and graphic analysis.,29,Software_Development
APAC,onet_task,0,onet_task_count,identify methods for interfacing web application technologies with enterprise resource planning or other system software.,28,Software_Development
APAC,onet_task,0,onet_task_count,develop data models and databases.,27,Administrative_Support
APAC,onet_task,0,onet_task_count,write research reports and other publications to document and communicate research findings.,26,Research_Analysis
APAC,onet_task,0,onet_task_count,analyze market conditions to determine optimum times to execute securities transactions.,26,Financial_Services
APAC,onet_task,0,onet_task_count,write technical documents or academic articles to communicate study results or economic forecasts.,25,Research_Analysis
APAC,onet_task,0,onet_task_count,record and edit the minutes of meetings and distribute to appropriate officials or staff members.,25,Administrative_Support
APAC,onet_task,0,onet_task_count,provide employees with guidance in handling difficult or complex problems or in resolving escalated complaints or disputes.,23,Administrative_Support
APAC,onet_task,0,onet_task_count,compose and edit scripts or provide screenwriters with story outlines from which scripts can be written.,23,Administrative_Support
APAC,onet_task,0,onet_task_count,create content strategies for digital media.,23,Creative_Communications
APAC,onet_task,0,onet_task_count,teach undergraduate level courses.,23,Education_Training
APAC,onet_task,0,onet_task_count,document technical functions and specifications for new or proposed content management systems.,23,Business_Management
APAC,onet_task,0,onet_task_count,plan and follow the most efficient routes for delivering goods.,23,Administrative_Support
APAC,onet_task,0,onet_task_count,develop specialized computer software routines to customize and integrate image analysis.,22,Software_Development
APAC,onet_task,0,onet_task_count,explain and demonstrate artistic techniques.,21,Creative_Communications
APAC,onet_task,0,onet_task_count,use informatics science to design or implement health information technology applications to resolve clinical or health care administrative problems.,20,Healthcare_Medical
APAC,onet_task,0,onet_task_count,monitor financial or operational performance of individual investments to ensure portfolios meet risk goals.,20,Financial_Services
APAC,onet_task,0,onet_task_count,write and edit news stories from information collected by reporters and other sources.,20,Administrative_Support
APAC,onet_task,0,onet_task_count,retrieve information from central databases for storage in a library's computer.,20,Administrative_Support
APAC,onet_task,0,onet_task_count,adapt text to accommodate musical requirements of composers and singers.,18,Administrative_Support
APAC,onet_task,0,onet_task_count,examine specimens using microscopes to evaluate specimen quality.,18,Research_Analysis
APAC,onet_task,0,onet_task_count,design and implement warehouse database structures.,18,Creative_Communications
APAC,onet_task,0,onet_task_count,coordinate implementation of computer system plan with establishment personnel and outside vendors.,18,Business_Management
APAC,onet_task,0,onet_task_count,process and review employment applications to evaluate qualifications or eligibility of applicants.,18,Administrative_Support
APAC,onet_task,0,onet_task_count,research hardware or software products to meet technical networking or security needs.,18,Research_Analysis
APAC,onet_task,0,onet_task_count,teach biomedical engineering or disseminate knowledge about the field through writing or consulting.,18,Professional_Services
APAC,onet_task,0,onet_task_count,prepare forms or agreements to complete sales.,17,Creative_Communications
APAC,onet_task,0,onet_task_count,advise or assist in obtaining patents or meeting other legal requirements.,17,Administrative_Support
APAC,onet_task,0,onet_task_count,debug robotics programs.,17,Software_Development
APAC,onet_task,0,onet_task_count,formulate strategic plans for the institution.,17,Business_Management
APAC,onet_task,0,onet_task_count,write detailed analysis plans and descriptions of analyses and findings for research protocols or reports.,17,Research_Analysis
APAC,onet_task,0,onet_task_count,analyze problems to develop solutions involving computer hardware and software.,17,Research_Analysis
APAC,onet_task,0,onet_task_count,develop system interaction or sequence diagrams.,17,Software_Development
APAC,onet_task,0,onet_task_count,develop instruction or training roadmaps for online and blended learning programs.,17,Education_Training
APAC,onet_task,0,onet_task_count,teach patients how to deal constructively with their emotions.,16,Education_Training
APAC,onet_task,0,onet_task_count,provide information from the institution's holdings to other curators and to the public.,16,Administrative_Support
APAC,onet_task,0,onet_task_count,encourage individuals and family members to develop and use skills and strategies for confronting their problems in a constructive manner.,16,Administrative_Support
APAC,onet_task,0,onet_task_count,evaluate existing systems to determine effectiveness and suggest changes to meet organizational requirements.,16,Business_Management
APAC,onet_task,0,onet_task_count,provide applicants with assistance in completing application forms such as those for job referrals or unemployment compensation claims.,16,Customer_Service
APAC,onet_task,0,onet_task_count,compile and analyze data obtained from monitoring or diagnostic tests.,16,Research_Analysis
APAC,onet_task,0,onet_task_count,prepare functional or technical documentation for data warehouses.,16,Administrative_Support
APAC,onet_task,0,onet_task_count,draw conclusions or make predictions based on data summaries or statistical analyses.,16,Research_Analysis
APAC,onet_task,0,onet_task_count,provide technical support to clients in the implementation of designed instruction or in task analyses and instructional systems design.,16,Education_Training
APAC,onet_task,0,onet_task_count,write instructional articles on designated subjects.,15,Education_Training
APAC,onet_task,0,onet_task_count,identify and respond to emergency physical or mental health situations.,15,Healthcare_Medical
APAC,onet_task,0,onet_task_count,prepare comprehensive interpretive reports of findings.,15,Research_Analysis
APAC,onet_task,0,onet_task_count,collect data through surveys or experimentation.,15,Research_Analysis
APAC,onet_task,0,onet_task_count,provide guidelines for implementing secure systems to customers or installation teams.,15,Customer_Service
APAC,onet_task,0,onet_task_count,greet customers entering establishments.,15,Customer_Service
APAC,onet_task,0,onet_task_count,perform risk assessments and execute tests of data processing system to ensure functioning of data processing activities and security measures.,15,Software_Development
APAC,onet_task,0,onet_task_count,review employment applications and job orders to match applicants with job requirements.,15,Administrative_Support
APAC,onet_task,0,onet_task_count,analyze developments in specific field to determine need for revisions in previously published materials and development of new material.,15,Research_Analysis
APAC,onet_task,0,onet_task_count,manage client portfolios,0,Business_Management
APAC,onet_task,0,onet_task_count,explain to customers the different types of loans and credit options that are available,0,Financial_Services
